{
  "schemaVersion": 1,
  "id": "factory-tracer-bullet",
  "request": "Соседи закрывают одну ограниченную бытовую задачу через понятное обязательство и наблюдаемый результат",
  "targetProduct": "vk-music",
  "strategy": "differentiation",
  "preferences": [
    "Структурный fixture проверяет проводку пайплайна, а не качество продуктовой идеи"
  ]
}
