{
  "schemaVersion": 1,
  "id": "circles-vk",
  "request": "Социальная сеть малых кругов по интересам, где люди публикуют живой прогресс, получают конкретные ответы и договариваются о совместном действии.",
  "targetProduct": "vkontakte",
  "strategy": "mimicry",
  "capabilityPolicy": "all",
  "preferences": [
    "Главная — авторская лента, а не dashboard и не каталог",
    "Продуктово и визуально близко к обычному ВКонтакте",
    "Каждая кнопка имеет один понятный и предсказуемый результат",
    "Все 22 capability профиля ВК имеют реальную реализацию и наблюдаемый результат"
  ]
}
