{
  "schemaVersion": 1,
  "id": "cold-1787723907395",
  "request": "Придумай и собери цельное локально работающее социальное приложение в мимикрии ВКонтакте. Оно должно иметь сильную самостоятельную продуктовую идею, авторскую ленту и естественный повторяемый социальный цикл; не копируй существующие концепты и не собирай каталог функций.",
  "targetProduct": "vkontakte",
  "strategy": "mimicry",
  "capabilityPolicy": "all",
  "preferences": []
}
