{
  "schemaVersion": 1,
  "id": "dvor-v2",
  "request": "Закрытая социальная сеть одного многоквартирного дома: соседи публикуют обычные посты и адресные дела, обсуждают происходящее и видят наблюдаемый результат общих действий",
  "targetProduct": "vkontakte",
  "strategy": "mimicry",
  "preferences": [
    "Главная — знакомая лента дома в логике ВКонтакте, а не список заявок",
    "Адресное дело — один понятный тип публикации со статусом и следующим действием",
    "Каждый видимый контрол имеет один предсказуемый outcome из Experience Contract",
    "Системные доступы запрашиваются только внутри функции, которая уже имеет самостоятельную продуктовую ценность",
    "Навигационный chrome, плотность, типографика и Lucide product icons следуют профилю vk-ios без копирования продуктовых сущностей Образов"
  ]
}
